{
  "season": "2026-27",
  "gw": 1,
  "status": "sealed",
  "summary": {
    "gw": 1,
    "status": "sealed",
    "manager": null,
    "manager_avatar": null,
    "score": 58,
    "total_points": 58,
    "overall_rank": 2201654,
    "gw_rank": 2201657,
    "chips": [],
    "transfers_count": 0,
    "transfers_cost": 0,
    "has_detail": true
  },
  "lineup": {
    "starters": [
      {
        "element": 384,
        "name": "Donnarumma",
        "team": "MCI",
        "position_type": "GKP",
        "is_captain": false,
        "is_vice_captain": false,
        "multiplier": 1,
        "is_substitute": false
      },
      {
        "element": 391,
        "name": "Gvardiol",
        "team": "MCI",
        "position_type": "DEF",
        "is_captain": false,
        "is_vice_captain": false,
        "multiplier": 1,
        "is_substitute": false
      },
      {
        "element": 229,
        "name": "Tarkowski",
        "team": "EVE",
        "position_type": "DEF",
        "is_captain": false,
        "is_vice_captain": false,
        "multiplier": 1,
        "is_substitute": false
      },
      {
        "element": 4,
        "name": "Gabriel",
        "team": "ARS",
        "position_type": "DEF",
        "is_captain": true,
        "is_vice_captain": false,
        "multiplier": 2,
        "is_substitute": false
      },
      {
        "element": 201,
        "name": "Muñoz",
        "team": "NFO",
        "position_type": "DEF",
        "is_captain": false,
        "is_vice_captain": false,
        "multiplier": 1,
        "is_substitute": false
      },
      {
        "element": 13,
        "name": "Rice",
        "team": "ARS",
        "position_type": "MID",
        "is_captain": false,
        "is_vice_captain": false,
        "multiplier": 1,
        "is_substitute": false
      },
      {
        "element": 366,
        "name": "Wirtz",
        "team": "LIV",
        "position_type": "MID",
        "is_captain": false,
        "is_vice_captain": false,
        "multiplier": 1,
        "is_substitute": false
      },
      {
        "element": 481,
        "name": "Anderson",
        "team": "MCI",
        "position_type": "MID",
        "is_captain": false,
        "is_vice_captain": false,
        "multiplier": 1,
        "is_substitute": false
      },
      {
        "element": 367,
        "name": "Gakpo",
        "team": "LIV",
        "position_type": "MID",
        "is_captain": false,
        "is_vice_captain": false,
        "multiplier": 1,
        "is_substitute": false
      },
      {
        "element": 165,
        "name": "João Pedro",
        "team": "CHE",
        "position_type": "FWD",
        "is_captain": false,
        "is_vice_captain": true,
        "multiplier": 1,
        "is_substitute": false
      },
      {
        "element": 106,
        "name": "Thiago",
        "team": "BRE",
        "position_type": "FWD",
        "is_captain": false,
        "is_vice_captain": false,
        "multiplier": 1,
        "is_substitute": false
      }
    ],
    "subs": [
      {
        "element": 58,
        "name": "Forster",
        "team": "BOU",
        "position_type": "GKP",
        "is_captain": false,
        "is_vice_captain": false,
        "multiplier": 0,
        "is_substitute": true
      },
      {
        "element": 40,
        "name": "Rogers",
        "team": "CHE",
        "position_type": "MID",
        "is_captain": false,
        "is_vice_captain": false,
        "multiplier": 0,
        "is_substitute": true
      },
      {
        "element": 55,
        "name": "Watkins",
        "team": "AVL",
        "position_type": "FWD",
        "is_captain": false,
        "is_vice_captain": false,
        "multiplier": 0,
        "is_substitute": true
      },
      {
        "element": 200,
        "name": "Lacroix",
        "team": "CHE",
        "position_type": "DEF",
        "is_captain": false,
        "is_vice_captain": false,
        "multiplier": 0,
        "is_substitute": true
      }
    ]
  },
  "transfers": [],
  "chips": []
}
