{
  "season": "2026-27",
  "gw": 8,
  "status": "live",
  "summary": {
    "gw": 8,
    "status": "live",
    "manager": "remember",
    "manager_avatar": "assets/avatar/remember.jpg",
    "score": 0,
    "total_points": 434,
    "overall_rank": 3547998,
    "gw_rank": 10969993,
    "chips": [],
    "transfers_count": 5,
    "transfers_cost": 0,
    "has_detail": true
  },
  "lineup": {
    "starters": [
      {
        "element": 384,
        "name": "Donnarumma",
        "team": "MCI",
        "position_type": "GKP",
        "is_captain": false,
        "is_vice_captain": false,
        "multiplier": 1,
        "is_substitute": false,
        "points": 1
      },
      {
        "element": 4,
        "name": "Gabriel",
        "team": "ARS",
        "position_type": "DEF",
        "is_captain": false,
        "is_vice_captain": false,
        "multiplier": 1,
        "is_substitute": false,
        "points": 16
      },
      {
        "element": 334,
        "name": "Muharemović",
        "team": "LEE",
        "position_type": "DEF",
        "is_captain": false,
        "is_vice_captain": false,
        "multiplier": 1,
        "is_substitute": false,
        "points": 0
      },
      {
        "element": 31,
        "name": "Konsa",
        "team": "ARS",
        "position_type": "DEF",
        "is_captain": false,
        "is_vice_captain": false,
        "multiplier": 1,
        "is_substitute": false,
        "points": 15
      },
      {
        "element": 124,
        "name": "Groß",
        "team": "BHA",
        "position_type": "MID",
        "is_captain": false,
        "is_vice_captain": false,
        "multiplier": 1,
        "is_substitute": false,
        "points": 0
      },
      {
        "element": 13,
        "name": "Rice",
        "team": "ARS",
        "position_type": "MID",
        "is_captain": false,
        "is_vice_captain": false,
        "multiplier": 1,
        "is_substitute": false,
        "points": 3
      },
      {
        "element": 154,
        "name": "Palmer",
        "team": "CHE",
        "position_type": "MID",
        "is_captain": false,
        "is_vice_captain": false,
        "multiplier": 1,
        "is_substitute": false,
        "points": -1
      },
      {
        "element": 40,
        "name": "Rogers",
        "team": "CHE",
        "position_type": "MID",
        "is_captain": false,
        "is_vice_captain": false,
        "multiplier": 1,
        "is_substitute": false,
        "points": 1
      },
      {
        "element": 106,
        "name": "Thiago",
        "team": "BRE",
        "position_type": "FWD",
        "is_captain": false,
        "is_vice_captain": false,
        "multiplier": 1,
        "is_substitute": false,
        "points": 0
      },
      {
        "element": 346,
        "name": "Calvert-Lewin",
        "team": "LEE",
        "position_type": "FWD",
        "is_captain": false,
        "is_vice_captain": true,
        "multiplier": 1,
        "is_substitute": false,
        "points": 0
      },
      {
        "element": 165,
        "name": "João Pedro",
        "team": "CHE",
        "position_type": "FWD",
        "is_captain": true,
        "is_vice_captain": false,
        "multiplier": 2,
        "is_substitute": false,
        "points": 0
      }
    ],
    "subs": [
      {
        "element": 58,
        "name": "Forster",
        "team": "BOU",
        "position_type": "GKP",
        "is_captain": false,
        "is_vice_captain": false,
        "multiplier": 0,
        "is_substitute": true,
        "points": 0
      },
      {
        "element": 367,
        "name": "Gakpo",
        "team": "LIV",
        "position_type": "MID",
        "is_captain": false,
        "is_vice_captain": false,
        "multiplier": 0,
        "is_substitute": true,
        "points": 0
      },
      {
        "element": 115,
        "name": "De Cuyper",
        "team": "BHA",
        "position_type": "DEF",
        "is_captain": false,
        "is_vice_captain": false,
        "multiplier": 0,
        "is_substitute": true,
        "points": 0
      },
      {
        "element": 391,
        "name": "Gvardiol",
        "team": "MCI",
        "position_type": "DEF",
        "is_captain": false,
        "is_vice_captain": false,
        "multiplier": 0,
        "is_substitute": true,
        "points": 1
      }
    ]
  },
  "transfers": [
    {
      "element_in": 334,
      "element_in_name": "Muharemović",
      "element_out": 201,
      "element_out_name": "Muñoz",
      "gw": 8,
      "time_utc": "2026-10-19T03:54:51.709979Z"
    },
    {
      "element_in": 31,
      "element_in_name": "Konsa",
      "element_out": 229,
      "element_out_name": "Tarkowski",
      "gw": 8,
      "time_utc": "2026-10-19T03:54:51.715045Z"
    },
    {
      "element_in": 154,
      "element_in_name": "Palmer",
      "element_out": 366,
      "element_out_name": "Wirtz",
      "gw": 8,
      "time_utc": "2026-10-19T03:54:51.715323Z"
    },
    {
      "element_in": 124,
      "element_in_name": "Groß",
      "element_out": 481,
      "element_out_name": "Anderson",
      "gw": 8,
      "time_utc": "2026-10-19T03:54:51.715525Z"
    },
    {
      "element_in": 346,
      "element_in_name": "Calvert-Lewin",
      "element_out": 55,
      "element_out_name": "Watkins",
      "gw": 8,
      "time_utc": "2026-10-19T03:54:51.715717Z"
    }
  ],
  "chips": []
}
